{
  "schema_version": "delivery-controlled-change-set/v1",
  "id": "controlled_change_test",
  "organization_id": "org_test",
  "project_id": "project_test",
  "binding": {
    "selection_id": "selection_test",
    "observatory_run_id": "observatory_test",
    "observatory_run_canonical_hash": "aaaaaaaaaaaaaaaaaaaaaaaaaaaaaaaaaaaaaaaaaaaaaaaaaaaaaaaaaaaaaaaa",
    "operator_feedback_id": "feedback_test",
    "operator_feedback_canonical_hash": "bbbbbbbbbbbbbbbbbbbbbbbbbbbbbbbbbbbbbbbbbbbbbbbbbbbbbbbbbbbbbbbb",
    "operator_feedback_disposition": "accepted",
    "plan_id": "plan_test",
    "plan_version": 2,
    "plan_canonical_hash": "cccccccccccccccccccccccccccccccccccccccccccccccccccccccccccccccc",
    "intent_id": "intent_test",
    "intent_version": 1,
    "intent_canonical_hash": "dddddddddddddddddddddddddddddddddddddddddddddddddddddddddddddddd",
    "decision_id": "decision_test",
    "decision_canonical_hash": "eeeeeeeeeeeeeeeeeeeeeeeeeeeeeeeeeeeeeeeeeeeeeeeeeeeeeeeeeeeeeeee",
    "configuration_id": "configuration_test",
    "configuration_version": 3,
    "configuration_canonical_hash": "ffffffffffffffffffffffffffffffffffffffffffffffffffffffffffffffff",
    "workflow_id": "workflow_test",
    "workflow_canonical_hash": "1111111111111111111111111111111111111111111111111111111111111111",
    "account_reference_id": "account_test",
    "object_fingerprint": "oceanengine-project-fingerprint-test",
    "skill_id": "oceanengine-ecommerce-manual",
    "skill_version": "v0.1-calibration"
  },
  "action": "create_project_and_promotions",
  "budget_limit_minor": 30000,
  "currency": "CNY",
  "status": "ready_for_approval",
  "canonical_hash": "2222222222222222222222222222222222222222222222222222222222222222",
  "version": 1,
  "created_by": "operator_test",
  "created_at": "2026-08-12T10:00:00Z",
  "updated_at": "2026-08-12T10:00:00Z"
}
